"titulo","resumen","categoria","autor","fecha","link"
"Sube a tres los muertos por colapso de puente en Ecuador","
 Luego del siniestro, un tráiler cargado con maíz quedó atrapado ...","Mundo","AFP","21 de marzo de 2025","https://www.la-razon.com/mundo/2025/03/21/sube-a-tres-los-muertos-por-colapso-de-puente-en-ecuador/"
"Mueren 44 civiles en un ataque yihadista en el suroeste de Níger","
 El pueblo de Fonbita, en la comuna rural de Kokorou, ...","Mundo","AFP","21 de marzo de 2025","https://www.la-razon.com/mundo/2025/03/21/ataque-yihadista-en-niger/"
"Choferes suspenden el paro de 48 horas tras acuerdo con el Gobierno","
 Representantes del transporte y el Gobierno se reunieron para abordar ...","Ciudades","Aylin Peñaranda","21 de marzo de 2025","https://www.la-razon.com/ciudades/2025/03/21/choferes-suspenden-el-paro-de-48-horas-tras-acuerdo-con-el-gobierno/"
"Durante la época de lluvias, la ABC atiende entre 3 y 4 derrumbes diarios en carreteras","
 El presidente de la entidad, Marcel Claure, informó de que ...","Economía","Erika Ibáñez","9 de marzo de 2025","https://www.la-razon.com/economia/2025/03/09/durante-la-epoca-de-lluvias-la-abc-atiende-entre-3-y-4-derrumbes-diarios-en-carreteras/"
"Cusicanqui urge a la Asamblea aprobar créditos por $us 325 MM para desastres naturales","
 El ministro de Planificación dijo que son créditos de la ...","Economía","Erika Ibáñez","9 de marzo de 2025","https://www.la-razon.com/economia/2025/03/09/cusicanqui-urge-a-la-asamblea-aprobar-creditos-por-us-325-mm-para-desastres-naturales/"
"La planta de papa en El Alto procesará 374 toneladas de materia prima","
 El viceministro Luis Siles dijo que se prevé que la ...","Economía","Erika Ibáñez","9 de marzo de 2025","https://www.la-razon.com/economia/2025/03/09/la-planta-de-papa-en-el-alto-procesara-374-toneladas-de-materia-prima/"
"YPFB estima que subvención baja en 40% y 60% por litro comercializado de gasolinas Premium","
 El gerente de Planificación Corporativo explicó que es una estimación ...","Economía","Erika Ibáñez","9 de marzo de 2025","https://www.la-razon.com/economia/2025/03/09/ypfb-estima-que-subvencion-baja-en-40-y-60-por-litro-comercializado-de-gasolinas-premium/"
"‘No hay gasolinazo’: YPFB dice que gasolina en Bolivia es la más económica de la región","
 El gerente de Planificación de YPFB descartó las afirmaciones de ...","Economía","Erika Ibáñez","9 de marzo de 2025","https://www.la-razon.com/economia/2025/03/09/no-hay-gasolinazo-ypfb-dice-que-gasolina-en-bolivia-es-la-mas-economica-de-la-region/"
"Familias afectadas por las lluvias ya superan las 300.000 en el país","
 La temporada de precipitaciones causa desastres y muertes en varios ...","Sociedad","Aylin Peñaranda","21 de marzo de 2025","https://www.la-razon.com/sociedad/2025/03/21/familias-afectadas-por-las-lluvias-ya-superan-las-300-000-en-el-pais/"
"Sube a tres los muertos por colapso de puente en Ecuador","
 Luego del siniestro, un tráiler cargado con maíz quedó atrapado ...","Mundo","AFP","21 de marzo de 2025","https://www.la-razon.com/mundo/2025/03/21/sube-a-tres-los-muertos-por-colapso-de-puente-en-ecuador/"
"Mueren 44 civiles en un ataque yihadista en el suroeste de Níger","
 El pueblo de Fonbita, en la comuna rural de Kokorou, ...","Mundo","AFP","21 de marzo de 2025","https://www.la-razon.com/mundo/2025/03/21/ataque-yihadista-en-niger/"
"Choferes suspenden el paro de 48 horas tras acuerdo con el Gobierno","
 Representantes del transporte y el Gobierno se reunieron para abordar ...","Ciudades","Aylin Peñaranda","21 de marzo de 2025","https://www.la-razon.com/ciudades/2025/03/21/choferes-suspenden-el-paro-de-48-horas-tras-acuerdo-con-el-gobierno/"
"La planta de papa en El Alto procesará 374 toneladas de materia prima","
 El viceministro Luis Siles dijo que se prevé que la ...","Economía","Erika Ibáñez","9 de marzo de 2025","https://www.la-razon.com/economia/2025/03/09/la-planta-de-papa-en-el-alto-procesara-374-toneladas-de-materia-prima/"
"YPFB estima que subvención baja en 40% y 60% por litro comercializado de gasolinas Premium","
 El gerente de Planificación Corporativo explicó que es una estimación ...","Economía","Erika Ibáñez","9 de marzo de 2025","https://www.la-razon.com/economia/2025/03/09/ypfb-estima-que-subvencion-baja-en-40-y-60-por-litro-comercializado-de-gasolinas-premium/"
"‘No hay gasolinazo’: YPFB dice que gasolina en Bolivia es la más económica de la región","
 El gerente de Planificación de YPFB descartó las afirmaciones de ...","Economía","Erika Ibáñez","9 de marzo de 2025","https://www.la-razon.com/economia/2025/03/09/no-hay-gasolinazo-ypfb-dice-que-gasolina-en-bolivia-es-la-mas-economica-de-la-region/"
"‘Ya nos cansamos’: soyeros alertan que el grano se pudre y sin diésel no pueden cosechar","
 El dirigente Eliazer Arellano explicó que con las lluvias algunas ...","Economía","Erika Ibáñez","9 de marzo de 2025","https://www.la-razon.com/economia/2025/03/09/ya-nos-cansamos-soyeros-alertan-que-el-grano-se-pudre-y-sin-diesel-no-pueden-cosechar/"
"ONU Mujeres y BID resaltan que la inversión de género es una ‘decisión económica inteligente’","
 Verónica Gavilanes, gerente del BancoSol resaltó que las empresas propiedad ...","Economía","Erika Ibáñez","9 de marzo de 2025","https://www.la-razon.com/economia/2025/03/09/onu-mujeres-y-bid-resaltan-que-la-inversion-de-genero-es-una-decision-economica-inteligente/"
"Miles de turcos protestan por el arresto del principal rival de Erdogan","
 Cientos de miles de personas se movilizaron en la tercera ...","Mundo","AFP","21 de marzo de 2025","https://www.la-razon.com/mundo/2025/03/21/miles-de-turcos-protestan-por-el-arresto-del-principal-rival-de-erdogan/"
"ANH detalla desvío ilegal de combustible en Caranavi tras hallazgo de cisternas","
 Las autoridades identificaron desconexión de GPS y falta de hoja ...","Economía","Daniel Zenteno","21 de marzo de 2025","https://www.la-razon.com/economia/2025/03/21/1050417/"
"Morales acusa a Arce de conocer la situación del gas y no hacer observaciones","
 El exmandatario considera que el actual presidente intenta “lavarse las ...","Economía","Daniel Zenteno","21 de marzo de 2025","https://www.la-razon.com/economia/2025/03/21/morales-acusa-a-arce-de-conocer-la-situacion-del-gas-y-no-hacer-observaciones/"
"Pese al acuerdo, Choferes dan plazo de 48 horas para destitución de autoridades","
 Caso contrario, el sector del transporte acatará el paro de ...","Economía","Daniel Zenteno","21 de marzo de 2025","https://www.la-razon.com/economia/2025/03/21/pese-al-acuerdo-choferes-dan-plazo-de-48-horas-para-destitucion-de-autoridades/"
"Camebol: mujeres inician sus emprendimientos con capital propio o préstamos familiares","
 La presidenta de la entidad, Edmy Campos, remarcó que es ...","Economía","Erika Ibáñez","9 de marzo de 2025","https://www.la-razon.com/economia/2025/03/09/camebol-mujeres-inician-sus-emprendimientos-con-capital-propio-o-prestamos-familiares/"
"El acceso al crédito es una de las brechas para el empoderamiento de la mujer","
 El tema fue analizado en el foro “De la intención ...","Economía","Erika Ibáñez","9 de marzo de 2025","https://www.la-razon.com/economia/2025/03/09/el-acceso-al-credito-es-una-de-las-brechas-para-el-empoderamiento-de-la-mujer/"
"En 2024, Vías Bolivia recaudó Bs 662.296.915 por cobro de peajes en el país","
 En el informe de Rendición Pública de Cuentas, el director ...","Economía","Erika Ibáñez","8 de marzo de 2025","https://www.la-razon.com/economia/2025/03/08/en-2024-vias-bolivia-recaudo-bs-662-296-915-por-cobro-de-peajes-en-el-pais/"
"Se colocan barreras en rutas clandestinas de Guaqui y Desaguadero para frenar el contrabando","
 El viceministro de Lucha contra el Contrabando, Luis Amílcar Velásquez, ...","Economía","Erika Ibáñez","8 de marzo de 2025","https://www.la-razon.com/economia/2025/03/08/se-colocan-barreras-en-rutas-clandestinas-de-guaqui-y-desaguadero-para-frenar-el-contrabando/"
"En Bolivia, 125.698 empresas son dirigidas por mujeres","
 Las empresas unipersonales son la forma jurídica preferida por las ...","Economía","Erika Ibáñez","8 de marzo de 2025","https://www.la-razon.com/economia/2025/03/08/en-bolivia-125-698-empresas-son-dirigidas-por-mujeres/"
"Miles de turcos protestan por el arresto del principal rival de Erdogan","
 Cientos de miles de personas se movilizaron en la tercera ...","Mundo","AFP","21 de marzo de 2025","https://www.la-razon.com/mundo/2025/03/21/miles-de-turcos-protestan-por-el-arresto-del-principal-rival-de-erdogan/"
"ANH detalla desvío ilegal de combustible en Caranavi tras hallazgo de cisternas","
 Las autoridades identificaron desconexión de GPS y falta de hoja ...","Economía","Daniel Zenteno","21 de marzo de 2025","https://www.la-razon.com/economia/2025/03/21/1050417/"
"Morales acusa a Arce de conocer la situación del gas y no hacer observaciones","
 El exmandatario considera que el actual presidente intenta “lavarse las ...","Economía","Daniel Zenteno","21 de marzo de 2025","https://www.la-razon.com/economia/2025/03/21/morales-acusa-a-arce-de-conocer-la-situacion-del-gas-y-no-hacer-observaciones/"
"Pese al acuerdo, Choferes dan plazo de 48 horas para destitución de autoridades","
 Caso contrario, el sector del transporte acatará el paro de ...","Economía","Daniel Zenteno","21 de marzo de 2025","https://www.la-razon.com/economia/2025/03/21/pese-al-acuerdo-choferes-dan-plazo-de-48-horas-para-destitucion-de-autoridades/"
"Se agudiza la escasez de diésel y las filas no desaparecen","
 En La Paz, Cochabamba y Santa Cruz los conductores reclaman. ...","Economía","Erika Ibáñez","8 de marzo de 2025","https://www.la-razon.com/economia/2025/03/08/se-agudiza-la-escasez-de-diesel-y-las-filas-no-desaparecen/"
"Adiós a Magis Tv: La ATT anuncia el bloqueo de aplicaciones ilegales de televisión","
 El director de la entidad, Néstor Ríos, explicó que estas ...","Economía","Erika Ibáñez","8 de marzo de 2025","https://www.la-razon.com/economia/2025/03/08/adios-a-magis-tv-la-att-anuncia-el-bloqueo-de-aplicaciones-ilegales-de-television/"
"El programa Mujer del BDP benefició a más de 13.000 productoras","
 El gerente de la entidad, Ariel Zabala, destacó que, a ...","Economía","Erika Ibáñez","8 de marzo de 2025","https://www.la-razon.com/economia/2025/03/08/el-programa-mujer-del-bdp-beneficio-a-mas-de-13-000-productoras/"
"Marianne Bolivia potenciará el comercio con Francia para el empoderamiento femenino","
 Claribel Aparicio destacó que Francia y Bolivia comparten un fuerte ...","Economía","Erika Ibáñez","8 de marzo de 2025","https://www.la-razon.com/economia/2025/03/08/marianne-bolivia-potenciara-el-comercio-con-francia-para-el-empoderamiento-femenino/"
"Interculturales de Yapacaní anuncian bloqueos desde el lunes por la falta de combustible","
 El dirigente Edwin Muñoz dijo que el Gobierno tiene hasta ...","Economía","Erika Ibáñez","8 de marzo de 2025","https://www.la-razon.com/economia/2025/03/08/interculturales-de-yapacani-anuncian-bloqueos-desde-el-lunes-por-la-falta-de-combustible/"
"Miles de turcos protestan por el arresto del principal rival de Erdogan","
 Cientos de miles de personas se movilizaron en la tercera ...","Mundo","AFP","21 de marzo de 2025","https://www.la-razon.com/mundo/2025/03/21/miles-de-turcos-protestan-por-el-arresto-del-principal-rival-de-erdogan/"
"ANH detalla desvío ilegal de combustible en Caranavi tras hallazgo de cisternas","
 Las autoridades identificaron desconexión de GPS y falta de hoja ...","Economía","Daniel Zenteno","21 de marzo de 2025","https://www.la-razon.com/economia/2025/03/21/1050417/"
"Morales acusa a Arce de conocer la situación del gas y no hacer observaciones","
 El exmandatario considera que el actual presidente intenta “lavarse las ...","Economía","Daniel Zenteno","21 de marzo de 2025","https://www.la-razon.com/economia/2025/03/21/morales-acusa-a-arce-de-conocer-la-situacion-del-gas-y-no-hacer-observaciones/"
"Pese al acuerdo, Choferes dan plazo de 48 horas para destitución de autoridades","
 Caso contrario, el sector del transporte acatará el paro de ...","Economía","Daniel Zenteno","21 de marzo de 2025","https://www.la-razon.com/economia/2025/03/21/pese-al-acuerdo-choferes-dan-plazo-de-48-horas-para-destitucion-de-autoridades/"
"Comisión de Diputados agenda crédito de $us 329 MM para planta de zinc","
 La Comisión de Planificación de la Cámara Baja tratará el ...","Economía","Daniel Zenteno","7 de marzo de 2025","https://www.la-razon.com/economia/2025/03/07/comision-de-diputados-agenda-credito-de-us-329-mm-para-planta-de-zinc/"
"Gobierno y mineros posponen diálogo sobre diésel; la reunión se reanudará el lunes","
 Tras horas sin acuerdo, Fecoman y autoridades aplazaron negociaciones y ...","Economía","Daniel Zenteno","7 de marzo de 2025","https://www.la-razon.com/economia/2025/03/07/gobierno-y-mineros-posponen-dialogo-sobre-diesel-la-reunion-se-reanudara-el-lunes/"
"Productores desmienten al Gobierno sobre aprovisionamiento de diésel","
 CAO y Cadex desmienten al ministro Yamil Flores, quien aseguró ...","Economía","Daniel Zenteno","7 de marzo de 2025","https://www.la-razon.com/economia/2025/03/07/1044608/"
"Gobierno reconoce que la planta procesadora de papa opera apenas al 33%","
 Hasta la fecha, se vendió más de 150 toneladas de ...","Economía","Daniel Zenteno","7 de marzo de 2025","https://www.la-razon.com/economia/2025/03/07/gobierno-reconoce-que-la-planta-procesadora-de-papa-opera-apenas-al-33/"
"Planta NPK de Cochabamba proyecta 45.000 toneladas y Bs 273,6 MM en 2025","
 El presidente Luis Arce anunció que la planta se consolidará ...","Economía","Daniel Zenteno","7 de marzo de 2025","https://www.la-razon.com/economia/2025/03/07/1044584/"
"Miles de turcos protestan por el arresto del principal rival de Erdogan","
 Cientos de miles de personas se movilizaron en la tercera ...","Mundo","AFP","21 de marzo de 2025","https://www.la-razon.com/mundo/2025/03/21/miles-de-turcos-protestan-por-el-arresto-del-principal-rival-de-erdogan/"
"ANH detalla desvío ilegal de combustible en Caranavi tras hallazgo de cisternas","
 Las autoridades identificaron desconexión de GPS y falta de hoja ...","Economía","Daniel Zenteno","21 de marzo de 2025","https://www.la-razon.com/economia/2025/03/21/1050417/"
"Morales acusa a Arce de conocer la situación del gas y no hacer observaciones","
 El exmandatario considera que el actual presidente intenta “lavarse las ...","Economía","Daniel Zenteno","21 de marzo de 2025","https://www.la-razon.com/economia/2025/03/21/morales-acusa-a-arce-de-conocer-la-situacion-del-gas-y-no-hacer-observaciones/"
"Pese al acuerdo, Choferes dan plazo de 48 horas para destitución de autoridades","
 Caso contrario, el sector del transporte acatará el paro de ...","Economía","Daniel Zenteno","21 de marzo de 2025","https://www.la-razon.com/economia/2025/03/21/pese-al-acuerdo-choferes-dan-plazo-de-48-horas-para-destitucion-de-autoridades/"
"Transportistas acusan al Gobierno de ‘gastarse toda la plata’ para combustibles","
 Sector del transporte pesado denuncia que camiones bolivianos están detenidos ...","Economía","Daniel Zenteno","7 de marzo de 2025","https://www.la-razon.com/economia/2025/03/07/1044583/"
"Sector lechero otorga un plazo de 72 horas al Gobierno para ajustar precios de la leche","
 En la conclusión de la reunión nacional, exigen a las ...","Economía","Daniel Zenteno","7 de marzo de 2025","https://www.la-razon.com/economia/2025/03/07/sector-lechero-otorga-un-plazo-de-72-horas-al-gobierno-para-ajustar-precios-de-la-leche/"
"La Unión Europa muestra su interés en explotar el litio boliviano","
 Sin embargo, el proceso se realizará de manera “estratégica y ...","Economía","Daniel Zenteno","7 de marzo de 2025","https://www.la-razon.com/economia/2025/03/07/la-union-europa-muestra-su-interes-en-explotar-el-litio-boliviano/"
"Gremiales de El Alto marcharán la próxima semana por falta de combustible","
 Otros sectores se sumarán a la medida de presión por ...","Economía","Daniel Zenteno","7 de marzo de 2025","https://www.la-razon.com/economia/2025/03/07/gremiales-de-el-alto-marcharan-la-proxima-semana-por-falta-de-combustible/"
"Surtidores privados denuncian paralización por falta de combustibles","
 Susy Dorado, gerente general de Asosur, alerta que los retrasos ...","Economía","Daniel Zenteno","7 de marzo de 2025","https://www.la-razon.com/economia/2025/03/07/surtidores-privados-denuncian-paralizacion-por-falta-de-combustibles/"
"Miles de turcos protestan por el arresto del principal rival de Erdogan","
 Cientos de miles de personas se movilizaron en la tercera ...","Mundo","AFP","21 de marzo de 2025","https://www.la-razon.com/mundo/2025/03/21/miles-de-turcos-protestan-por-el-arresto-del-principal-rival-de-erdogan/"
"ANH detalla desvío ilegal de combustible en Caranavi tras hallazgo de cisternas","
 Las autoridades identificaron desconexión de GPS y falta de hoja ...","Economía","Daniel Zenteno","21 de marzo de 2025","https://www.la-razon.com/economia/2025/03/21/1050417/"
"Morales acusa a Arce de conocer la situación del gas y no hacer observaciones","
 El exmandatario considera que el actual presidente intenta “lavarse las ...","Economía","Daniel Zenteno","21 de marzo de 2025","https://www.la-razon.com/economia/2025/03/21/morales-acusa-a-arce-de-conocer-la-situacion-del-gas-y-no-hacer-observaciones/"
"Pese al acuerdo, Choferes dan plazo de 48 horas para destitución de autoridades","
 Caso contrario, el sector del transporte acatará el paro de ...","Economía","Daniel Zenteno","21 de marzo de 2025","https://www.la-razon.com/economia/2025/03/21/pese-al-acuerdo-choferes-dan-plazo-de-48-horas-para-destitucion-de-autoridades/"
"Multisectores piden la liberación total de las exportaciones para ‘generar’ dólares","
 El presidente de Cadex dijo que urge cambiar el modelo ...","Economía","Erika Ibáñez","7 de marzo de 2025","https://www.la-razon.com/economia/2025/03/07/multisectores-piden-la-liberacion-total-de-las-exportaciones-para-generar-dolares/"
"Comité multisectorial resuelve marchar de Patacamaya a La Paz desde el 18 de marzo","
 Productores, transportistas y comerciantes se reunieron en Trinidad. Demandan, además, ...","Economía","Erika Ibáñez","7 de marzo de 2025","https://www.la-razon.com/economia/2025/03/07/comite-multisectorial-resuelve-marchar-de-patacamaya-a-la-paz-desde-el-18-de-marzo/"
"Sector lechero se reúne por aumento en los costos de producción","
 Representantes del sector se reúnen en Cochabamba este viernes para ...","Economía","Daniel Zenteno","7 de marzo de 2025","https://www.la-razon.com/economia/2025/03/07/sector-lechero-se-reune-por-aumento-en-los-costos-de-produccion/"
"Se subastarán 105 vehículos y un bote en La Paz","
 Dircabi espera recaudar $us 500.000. Habrá una exposición de los ...","Economía","Erika Ibáñez","7 de marzo de 2025","https://www.la-razon.com/economia/2025/03/07/se-subastaran-105-vehiculos-y-un-bote-en-la-paz/"
"Dólar paralelo encareció los medicamentos bolivianos","
 Aseguran que el mayor impacto para el sector ha sido ...","Economía","Diego Montaño","7 de marzo de 2025","https://www.la-razon.com/economia/2025/03/07/dolar-paralelo-encarecio-los-medicamentos-bolivianos/"
"Miles de turcos protestan por el arresto del principal rival de Erdogan","
 Cientos de miles de personas se movilizaron en la tercera ...","Mundo","AFP","21 de marzo de 2025","https://www.la-razon.com/mundo/2025/03/21/miles-de-turcos-protestan-por-el-arresto-del-principal-rival-de-erdogan/"
"ANH detalla desvío ilegal de combustible en Caranavi tras hallazgo de cisternas","
 Las autoridades identificaron desconexión de GPS y falta de hoja ...","Economía","Daniel Zenteno","21 de marzo de 2025","https://www.la-razon.com/economia/2025/03/21/1050417/"
"Morales acusa a Arce de conocer la situación del gas y no hacer observaciones","
 El exmandatario considera que el actual presidente intenta “lavarse las ...","Economía","Daniel Zenteno","21 de marzo de 2025","https://www.la-razon.com/economia/2025/03/21/morales-acusa-a-arce-de-conocer-la-situacion-del-gas-y-no-hacer-observaciones/"
"Pese al acuerdo, Choferes dan plazo de 48 horas para destitución de autoridades","
 Caso contrario, el sector del transporte acatará el paro de ...","Economía","Daniel Zenteno","21 de marzo de 2025","https://www.la-razon.com/economia/2025/03/21/pese-al-acuerdo-choferes-dan-plazo-de-48-horas-para-destitucion-de-autoridades/"
"Según gerente de YLB el 67% de los ingresos por litio se quedará en Bolivia","
 También negó que el interés de la deuda de YLB ...","Economía","Daniel Gutierrez","7 de marzo de 2025","https://www.la-razon.com/economia/2025/03/07/segun-gerente-de-ylb-el-67-de-los-ingresos-por-litio-se-quedara-en-bolivia/"
"A dinamitazos, mineros auríferos se movilizan y bloquean en La Paz por falta de diésel","
 Instalaron un bloqueo en la avenida Mariscal Santa Cruz y ...","Economía","Erika Ibáñez","7 de marzo de 2025","https://www.la-razon.com/economia/2025/03/07/a-dinamitazos-mineros-auriferos-se-movilizan-y-bloquean-en-la-paz-por-falta-de-diesel/"
"Gobierno garantiza al agro la entrega de 27 millones de litros de diésel para la ‘cosecha grande’","
 El ministro Yamil Flores, dijo que se cumplió ya con ...","Economía","Erika Ibáñez","7 de marzo de 2025","https://www.la-razon.com/economia/2025/03/07/gobierno-garantiza-la-entrega-de-27-millones-de-litros-de-diesel-para-la-cosecha-grande/"
"YLB y Universidad Católica de Lovaina trabajarán tecnologías para producción de litio","
 Las dos entidades firmaron un memorándum de entendimiento para la ...","Economía","Erika Ibáñez","7 de marzo de 2025","https://www.la-razon.com/economia/2025/03/07/ylb-y-universidad-catolica-de-lovaina-trabajaran-tecnologias-para-produccion-de-litio/"
"Cívicos cruceños piden importación ‘sin trabas ni burocracia’ de combustibles","
 En 2024, el Gobierno aprobó dos decretos supremos para liberar ...","Economía","Daniel Zenteno","6 de marzo de 2025","https://www.la-razon.com/economia/2025/03/06/1044214/"
"Miles de turcos protestan por el arresto del principal rival de Erdogan","
 Cientos de miles de personas se movilizaron en la tercera ...","Mundo","AFP","21 de marzo de 2025","https://www.la-razon.com/mundo/2025/03/21/miles-de-turcos-protestan-por-el-arresto-del-principal-rival-de-erdogan/"
"ANH detalla desvío ilegal de combustible en Caranavi tras hallazgo de cisternas","
 Las autoridades identificaron desconexión de GPS y falta de hoja ...","Economía","Daniel Zenteno","21 de marzo de 2025","https://www.la-razon.com/economia/2025/03/21/1050417/"
"Morales acusa a Arce de conocer la situación del gas y no hacer observaciones","
 El exmandatario considera que el actual presidente intenta “lavarse las ...","Economía","Daniel Zenteno","21 de marzo de 2025","https://www.la-razon.com/economia/2025/03/21/morales-acusa-a-arce-de-conocer-la-situacion-del-gas-y-no-hacer-observaciones/"
"Pese al acuerdo, Choferes dan plazo de 48 horas para destitución de autoridades","
 Caso contrario, el sector del transporte acatará el paro de ...","Economía","Daniel Zenteno","21 de marzo de 2025","https://www.la-razon.com/economia/2025/03/21/pese-al-acuerdo-choferes-dan-plazo-de-48-horas-para-destitucion-de-autoridades/"
"El Gobierno espera retomar exportaciones de carne de res este mes","
 El 5 de febrero las autoridades decidieron no autorizar nuevos ...","Economía","Daniel Zenteno","6 de marzo de 2025","https://www.la-razon.com/economia/2025/03/06/el-gobierno-espera-retomar-exportaciones-de-carne-de-res-este-mes/"
"Camacho dice que el Gobierno inventó una ‘leyenda negra contra Santa Cruz’","
 Las autoridades del Órgano Ejecutivo señalaron varias veces a los ...","Economía","Daniel Zenteno","6 de marzo de 2025","https://www.la-razon.com/economia/2025/03/06/1044170/"
"YLB y Australia exploran alianzas para industrializar litio en salares de Bolivia","
 YLB y la embajadora australiana analizaron experiencias en el marco ...","Economía","Daniel Zenteno","6 de marzo de 2025","https://www.la-razon.com/economia/2025/03/06/1044169/"
"Productores de Beni dicen que 5.000 hectáreas inundadas amenazan cosecha de arroz","
 Los productores arroceros alertan que las lluvias y la escasez ...","Economía","Daniel Zenteno","6 de marzo de 2025","https://www.la-razon.com/economia/2025/03/06/1044142/"
"Emapa se defiende y afirma que la planta procesadora de papa opera con normalidad","
 La activista María Galindo se trasladó a la factoría y ...","Economía","Daniel Zenteno","6 de marzo de 2025","https://www.la-razon.com/economia/2025/03/06/1044144/"
"Miles de turcos protestan por el arresto del principal rival de Erdogan","
 Cientos de miles de personas se movilizaron en la tercera ...","Mundo","AFP","21 de marzo de 2025","https://www.la-razon.com/mundo/2025/03/21/miles-de-turcos-protestan-por-el-arresto-del-principal-rival-de-erdogan/"
"ANH detalla desvío ilegal de combustible en Caranavi tras hallazgo de cisternas","
 Las autoridades identificaron desconexión de GPS y falta de hoja ...","Economía","Daniel Zenteno","21 de marzo de 2025","https://www.la-razon.com/economia/2025/03/21/1050417/"
"Morales acusa a Arce de conocer la situación del gas y no hacer observaciones","
 El exmandatario considera que el actual presidente intenta “lavarse las ...","Economía","Daniel Zenteno","21 de marzo de 2025","https://www.la-razon.com/economia/2025/03/21/morales-acusa-a-arce-de-conocer-la-situacion-del-gas-y-no-hacer-observaciones/"
