"titulo","resumen","categoria","autor","fecha","link"
"ANH y Policía coordinan la provisión controlada de combustibles tras llegada de cisternas","
 El Gobierno prioriza escolta militar a cisternas y controles fronterizos ...","Economía","Daniel Zenteno","17 de marzo de 2025","https://www.la-razon.com/economia/2025/03/17/anh-y-policia-coordinan-la-provision-controlada-de-combustibles-tras-la-llegada-de-cisternas/"
"Familias afectadas por las lluvias ya superan las 300.000 en el país","
 La temporada de precipitaciones causa desastres y muertes en varios ...","Sociedad","Aylin Peñaranda","21 de marzo de 2025","https://www.la-razon.com/sociedad/2025/03/21/familias-afectadas-por-las-lluvias-ya-superan-las-300-000-en-el-pais/"
"Sube a tres los muertos por colapso de puente en Ecuador","
 Luego del siniestro, un tráiler cargado con maíz quedó atrapado ...","Mundo","AFP","21 de marzo de 2025","https://www.la-razon.com/mundo/2025/03/21/sube-a-tres-los-muertos-por-colapso-de-puente-en-ecuador/"
"Mueren 44 civiles en un ataque yihadista en el suroeste de Níger","
 El pueblo de Fonbita, en la comuna rural de Kokorou, ...","Mundo","AFP","21 de marzo de 2025","https://www.la-razon.com/mundo/2025/03/21/ataque-yihadista-en-niger/"
"Choferes suspenden el paro de 48 horas tras acuerdo con el Gobierno","
 Representantes del transporte y el Gobierno se reunieron para abordar ...","Ciudades","Aylin Peñaranda","21 de marzo de 2025","https://www.la-razon.com/ciudades/2025/03/21/choferes-suspenden-el-paro-de-48-horas-tras-acuerdo-con-el-gobierno/"
"El transporte pesado se declara en quiebra y dice que ya no pagará peajes","
 Domingo Ramos, dirigente del sector, exigió a las autoridades reducir ...","Economía","Daniel Zenteno","17 de marzo de 2025","https://www.la-razon.com/economia/2025/03/17/el-transporte-pesado-se-declara-en-quiebra-y-dice-que-ya-no-pagara-peajes/"
"La aplicación de la ANH ya permite consultar disponibilidad de combustible","
 La Agencia Nacional de Hidrocarburos confirma que ""ANH Abastecimiento"" ya ...","Economía","Daniel Zenteno","17 de marzo de 2025","https://www.la-razon.com/economia/2025/03/17/la-aplicacion-de-la-anh-ya-permite-consultar-disponibilidad-de-combustible/"
"ANH aún evalúa la restricción de venta de combustible a vehículos irregulares","
 El viceministro Adams Hurtado aclaró que la propuesta de la ...","Economía","Daniel Zenteno","17 de marzo de 2025","https://www.la-razon.com/economia/2025/03/17/anh-aun-evalua-la-restriccion-de-venta-de-combustible-a-vehiculos-irregulares/"
"Bolivia se posiciona como el tercer país con mayor inflación en Sudamérica","
 Un informe del economista Fernando Romero advierte que la escalada ...","Economía","Daniel Zenteno","17 de marzo de 2025","https://www.la-razon.com/economia/2025/03/17/bolivia-se-posiciona-como-el-tercer-pais-con-mayor-inflacion-en-sudamerica/"
"Andrónico urge reunión para liberar créditos para compra de combustible","
 El presidente del Senado, Andrónico Rodríguez, sugiere reunión entre el ...","Economía","Daniel Zenteno","17 de marzo de 2025","https://www.la-razon.com/economia/2025/03/17/1048231/"
"Familias afectadas por las lluvias ya superan las 300.000 en el país","
 La temporada de precipitaciones causa desastres y muertes en varios ...","Sociedad","Aylin Peñaranda","21 de marzo de 2025","https://www.la-razon.com/sociedad/2025/03/21/familias-afectadas-por-las-lluvias-ya-superan-las-300-000-en-el-pais/"
"Sube a tres los muertos por colapso de puente en Ecuador","
 Luego del siniestro, un tráiler cargado con maíz quedó atrapado ...","Mundo","AFP","21 de marzo de 2025","https://www.la-razon.com/mundo/2025/03/21/sube-a-tres-los-muertos-por-colapso-de-puente-en-ecuador/"
"Mueren 44 civiles en un ataque yihadista en el suroeste de Níger","
 El pueblo de Fonbita, en la comuna rural de Kokorou, ...","Mundo","AFP","21 de marzo de 2025","https://www.la-razon.com/mundo/2025/03/21/ataque-yihadista-en-niger/"
"Choferes suspenden el paro de 48 horas tras acuerdo con el Gobierno","
 Representantes del transporte y el Gobierno se reunieron para abordar ...","Ciudades","Aylin Peñaranda","21 de marzo de 2025","https://www.la-razon.com/ciudades/2025/03/21/choferes-suspenden-el-paro-de-48-horas-tras-acuerdo-con-el-gobierno/"
"ABC asegura que Llavini no volverá a cerrar tras rehabilitación por derrumbe","
 Marcel Claure, presidente de la Administradora Boliviana de Carreteras, confirmó ...","Economía","Daniel Zenteno","16 de marzo de 2025","https://www.la-razon.com/economia/2025/03/16/abc-asegura-que-llavini-no-volvera-a-cerrar-tras-rehabilitacion-por-derrumbe/"
"Arce dice que se trabaja sin tregua para restablecer el abastecimiento de combustible","
 El Mandatario asegura que en esta semana los despachos de ...","Economía","Daniel Zenteno","16 de marzo de 2025","https://www.la-razon.com/economia/2025/03/16/arce-dice-que-se-trabaja-sin-tregua-para-restablecer-el-abastecimiento-de-combustible/"
"‘No hay motivos para movilizaciones’, dice el Gobierno tras arribo de combustible","
 El viceministro Adams Hurtado informó que se invitó a reuniones ...","Economía","Daniel Zenteno","16 de marzo de 2025","https://www.la-razon.com/economia/2025/03/16/no-hay-motivos-para-movilizaciones-dice-el-gobierno-tras-arribo-de-combustible/"
"Gobierno inicia acciones legales contra comerciantes por alza ‘abusiva’ de precios","
 El viceministro Jorge Silva denunció especulación con productos como aceite, ...","Economía","Daniel Zenteno","16 de marzo de 2025","https://www.la-razon.com/economia/2025/03/16/gobierno-inicia-acciones-legales-contra-comerciantes-por-alza-abusiva-de-precios/"
"La ABC ya utilizó la cuarta parte de los recursos del Plan Lluvias 2024-2025","
 Hasta la fecha, la Administradora Boliviana de Carreteras atendió más ...","Economía","Daniel Zenteno","16 de marzo de 2025","https://www.la-razon.com/economia/2025/03/16/la-abc-ya-utilizo-la-cuarta-parte-de-los-recursos-del-plan-lluvias-2024-2025/"
"Familias afectadas por las lluvias ya superan las 300.000 en el país","
 La temporada de precipitaciones causa desastres y muertes en varios ...","Sociedad","Aylin Peñaranda","21 de marzo de 2025","https://www.la-razon.com/sociedad/2025/03/21/familias-afectadas-por-las-lluvias-ya-superan-las-300-000-en-el-pais/"
"Sube a tres los muertos por colapso de puente en Ecuador","
 Luego del siniestro, un tráiler cargado con maíz quedó atrapado ...","Mundo","AFP","21 de marzo de 2025","https://www.la-razon.com/mundo/2025/03/21/sube-a-tres-los-muertos-por-colapso-de-puente-en-ecuador/"
"Mueren 44 civiles en un ataque yihadista en el suroeste de Níger","
 El pueblo de Fonbita, en la comuna rural de Kokorou, ...","Mundo","AFP","21 de marzo de 2025","https://www.la-razon.com/mundo/2025/03/21/ataque-yihadista-en-niger/"
"Choferes suspenden el paro de 48 horas tras acuerdo con el Gobierno","
 Representantes del transporte y el Gobierno se reunieron para abordar ...","Ciudades","Aylin Peñaranda","21 de marzo de 2025","https://www.la-razon.com/ciudades/2025/03/21/choferes-suspenden-el-paro-de-48-horas-tras-acuerdo-con-el-gobierno/"
"YPFB recibirá casi 70 millones de litros de combustible hasta el viernes","
 Posteriormente, con la descarga de otros buques, se recibirá cantidades ...","Economía","Daniel Zenteno","16 de marzo de 2025","https://www.la-razon.com/economia/2025/03/16/1048081/"
"YPFB completa descarga de combustible en Arica e inicia incremento en los despachos","
 El viceministro Adams Hurtado confirmó que las primeras cisternas del ...","Economía","Daniel Zenteno","16 de marzo de 2025","https://www.la-razon.com/economia/2025/03/16/ypfb-completa-descarga-de-combustible-en-arica-e-inicia-incremento-en-los-despachos/"
"Gasolina descargada en Arica y producción nacional abastecerá hasta 25 días la demanda nacional","
 El Gobierno y YPFB planificaron el arribo de nuevos barcos ...","Economía","Daniel Zenteno","16 de marzo de 2025","https://www.la-razon.com/economia/2025/03/16/gasolina-descargada-en-arica-y-produccion-nacional-abastecera-hasta-25-dias-la-demanda-nacional/"
"Gobierno pide al Ministerio Público coadyuvar en la lucha contra la especulación","
 El viceministro Jorge Silva pidió a las intendencias municipales controlar ...","Economía","Daniel Zenteno","16 de marzo de 2025","https://www.la-razon.com/economia/2025/03/16/gobierno-pide-al-ministerio-publico-coadyuvar-en-la-lucha-contra-la-especulacion/"
"ANH incauta 1.200 litros de diésel ilegal en Beni y desbarata red de acopio en Potosí","
 Operativos conjuntos con la Policía en San Borja y Potosí ...","Economía","Daniel Zenteno","16 de marzo de 2025","https://www.la-razon.com/economia/2025/03/16/anh-incauta-1-200-litros-de-diesel-ilegal-en-beni-y-desbarata-red-de-acopio-en-potosi/"
"Familias afectadas por las lluvias ya superan las 300.000 en el país","
 La temporada de precipitaciones causa desastres y muertes en varios ...","Sociedad","Aylin Peñaranda","21 de marzo de 2025","https://www.la-razon.com/sociedad/2025/03/21/familias-afectadas-por-las-lluvias-ya-superan-las-300-000-en-el-pais/"
"Sube a tres los muertos por colapso de puente en Ecuador","
 Luego del siniestro, un tráiler cargado con maíz quedó atrapado ...","Mundo","AFP","21 de marzo de 2025","https://www.la-razon.com/mundo/2025/03/21/sube-a-tres-los-muertos-por-colapso-de-puente-en-ecuador/"
"Mueren 44 civiles en un ataque yihadista en el suroeste de Níger","
 El pueblo de Fonbita, en la comuna rural de Kokorou, ...","Mundo","AFP","21 de marzo de 2025","https://www.la-razon.com/mundo/2025/03/21/ataque-yihadista-en-niger/"
"Choferes suspenden el paro de 48 horas tras acuerdo con el Gobierno","
 Representantes del transporte y el Gobierno se reunieron para abordar ...","Ciudades","Aylin Peñaranda","21 de marzo de 2025","https://www.la-razon.com/ciudades/2025/03/21/choferes-suspenden-el-paro-de-48-horas-tras-acuerdo-con-el-gobierno/"
"El país deberá decidir entre exportar gas o abastecer al mercado interno","
 El economista Fernando Romero advierte sobre la reducción en la ...","Economía","Daniel Zenteno","16 de marzo de 2025","https://www.la-razon.com/economia/2025/03/16/el-pais-debera-decidir-entre-exportar-gas-o-abastecer-al-mercado-interno/"
"La producción e ingresos por el gas se desploman","
 El negocio del gas natural sigue en declive en el ...","Economía","Daniel Zenteno","16 de marzo de 2025","https://www.la-razon.com/economia/2025/03/16/la-produccion-e-ingresos-por-el-gas-se-desploman/"
"Remesadoras cobran hasta 15% de comisión por giros en dólares","
 En Bolivia operan Western Union, MoneyGram, Ria Money Transfer, Giros ...","Economía","Boris Góngora","16 de marzo de 2025","https://www.la-razon.com/economia/2025/03/16/remesadoras-cobran-hasta-15-de-comision-por-giros-en-dolares/"
"La ANH realiza el control al despacho y distribución de GLP en La Paz y El Alto","
 Con escolta, los camiones distribuidores salieron desde tempranas horas de ...","Economía","Rosío Flores","16 de marzo de 2025","https://www.la-razon.com/economia/2025/03/16/la-anh-realiza-el-control-al-despacho-y-distribucion-de-glp-en-la-paz-y-el-alto/"
"Expertos belgas de KU Leuven fortalecen alianza con YLB en investigación y producción de litio","
 Una delegación de la Universidad Católica de Lovaina visitó plantas ...","Economía","Daniel Zenteno","15 de marzo de 2025","https://www.la-razon.com/economia/2025/03/15/1047823/"
"Familias afectadas por las lluvias ya superan las 300.000 en el país","
 La temporada de precipitaciones causa desastres y muertes en varios ...","Sociedad","Aylin Peñaranda","21 de marzo de 2025","https://www.la-razon.com/sociedad/2025/03/21/familias-afectadas-por-las-lluvias-ya-superan-las-300-000-en-el-pais/"
"Sube a tres los muertos por colapso de puente en Ecuador","
 Luego del siniestro, un tráiler cargado con maíz quedó atrapado ...","Mundo","AFP","21 de marzo de 2025","https://www.la-razon.com/mundo/2025/03/21/sube-a-tres-los-muertos-por-colapso-de-puente-en-ecuador/"
"Mueren 44 civiles en un ataque yihadista en el suroeste de Níger","
 El pueblo de Fonbita, en la comuna rural de Kokorou, ...","Mundo","AFP","21 de marzo de 2025","https://www.la-razon.com/mundo/2025/03/21/ataque-yihadista-en-niger/"
"Choferes suspenden el paro de 48 horas tras acuerdo con el Gobierno","
 Representantes del transporte y el Gobierno se reunieron para abordar ...","Ciudades","Aylin Peñaranda","21 de marzo de 2025","https://www.la-razon.com/ciudades/2025/03/21/choferes-suspenden-el-paro-de-48-horas-tras-acuerdo-con-el-gobierno/"
"YPFB asegura abastecimiento de GLP con 1.375 toneladas diarias y llama a la calma","
 Armin Dorgathen, presidente de la estatal, garantizó que el gas ...","Economía","Daniel Zenteno","15 de marzo de 2025","https://www.la-razon.com/economia/2025/03/15/1047804/"
"Cooperativas mineras exigen créditos para inyectar dólares y evitar crisis","
 Las cooperativas de Cochabamba demandan a la Asamblea Legislativa la ...","Economía","Daniel Zenteno","15 de marzo de 2025","https://www.la-razon.com/economia/2025/03/15/cooperativas-mineras-exigen-creditos-para-inyectar-dolares-y-evitar-crisis/"
"YPFB anuncia la llegada de cuatro buques más con combustibles antes de fin de mes","
 Armin Dorgathen, presidente de YPFB, confirmó que los cargamentos elevarán ...","Economía","Daniel Zenteno","15 de marzo de 2025","https://www.la-razon.com/economia/2025/03/15/ypfb-anuncia-la-llegada-de-cuatro-buques-mas-con-combustibles-antes-de-fin-de-mes/"
"Descarga de combustible en Chile demorará hasta 47 horas por buque","
 YPFB detalla que cada barco tarda entre 45 y 47 ...","Economía","Daniel Zenteno","15 de marzo de 2025","https://www.la-razon.com/economia/2025/03/15/1047745/"
"Andrónico dice que el Gobierno tiene más de $us 2.000 millones en ‘caja y bancos’","
 El titular del Senado reveló que en los últimos cinco ...","Economía","Daniel Zenteno","15 de marzo de 2025","https://www.la-razon.com/economia/2025/03/15/1047735/"
"Familias afectadas por las lluvias ya superan las 300.000 en el país","
 La temporada de precipitaciones causa desastres y muertes en varios ...","Sociedad","Aylin Peñaranda","21 de marzo de 2025","https://www.la-razon.com/sociedad/2025/03/21/familias-afectadas-por-las-lluvias-ya-superan-las-300-000-en-el-pais/"
"Sube a tres los muertos por colapso de puente en Ecuador","
 Luego del siniestro, un tráiler cargado con maíz quedó atrapado ...","Mundo","AFP","21 de marzo de 2025","https://www.la-razon.com/mundo/2025/03/21/sube-a-tres-los-muertos-por-colapso-de-puente-en-ecuador/"
"Mueren 44 civiles en un ataque yihadista en el suroeste de Níger","
 El pueblo de Fonbita, en la comuna rural de Kokorou, ...","Mundo","AFP","21 de marzo de 2025","https://www.la-razon.com/mundo/2025/03/21/ataque-yihadista-en-niger/"
"Choferes suspenden el paro de 48 horas tras acuerdo con el Gobierno","
 Representantes del transporte y el Gobierno se reunieron para abordar ...","Ciudades","Aylin Peñaranda","21 de marzo de 2025","https://www.la-razon.com/ciudades/2025/03/21/choferes-suspenden-el-paro-de-48-horas-tras-acuerdo-con-el-gobierno/"
"Gobierno asegura que la complicada coyuntura económica ‘es temporal’","
 El viceministro Jorge Silva aseguró que se está trabajando en ...","Economía","Daniel Zenteno","15 de marzo de 2025","https://www.la-razon.com/economia/2025/03/15/gobierno-asegura-que-la-complicada-coyuntura-economica-es-temporal/"
"Gobierno autoriza a cuatro empresas importar 84,6 millones de litros de diésel mensuales","
 El Ministerio de Hidrocarburos detalló que las firmas Latigidconst, Empacar, ...","Economía","Daniel Zenteno","15 de marzo de 2025","https://www.la-razon.com/economia/2025/03/15/gobierno-autoriza-a-cuatro-empresas-importar-846-millones-de-litros-de-diesel-mensuales/"
"Sector de Minerales crece 117% en tributos y fortalece la recaudación fiscal","
 El dinamismo en Comercio y Servicios Financieros también respalda al ...","Economía","Daniel Zenteno","15 de marzo de 2025","https://www.la-razon.com/economia/2025/03/15/sector-de-minerales-crece-117-en-tributos-y-fortalece-la-recaudacion-fiscal/"
"Restaurantes reinventan menús por escasez de diésel y divisas","
 Aserac confirmó que el sector opera en ""modo emergencia"" ante ...","Economía","Daniel Zenteno","15 de marzo de 2025","https://www.la-razon.com/economia/2025/03/15/restaurantes-reinventan-menus-por-escasez-de-diesel-y-divisas/"
"YPFB inicia descarga de 47 millones de litros de gasolina en Chile para aliviar escasez","
 El presidente Luis Arce informó que desde la terminal de ...","Economía","Daniel Zenteno","15 de marzo de 2025","https://www.la-razon.com/economia/2025/03/15/ypfb-inicia-descarga-de-47-millones-de-litros-de-gasolina-en-chile-para-aliviar-escasez/"
"Familias afectadas por las lluvias ya superan las 300.000 en el país","
 La temporada de precipitaciones causa desastres y muertes en varios ...","Sociedad","Aylin Peñaranda","21 de marzo de 2025","https://www.la-razon.com/sociedad/2025/03/21/familias-afectadas-por-las-lluvias-ya-superan-las-300-000-en-el-pais/"
"Sube a tres los muertos por colapso de puente en Ecuador","
 Luego del siniestro, un tráiler cargado con maíz quedó atrapado ...","Mundo","AFP","21 de marzo de 2025","https://www.la-razon.com/mundo/2025/03/21/sube-a-tres-los-muertos-por-colapso-de-puente-en-ecuador/"
"Mueren 44 civiles en un ataque yihadista en el suroeste de Níger","
 El pueblo de Fonbita, en la comuna rural de Kokorou, ...","Mundo","AFP","21 de marzo de 2025","https://www.la-razon.com/mundo/2025/03/21/ataque-yihadista-en-niger/"
"Choferes suspenden el paro de 48 horas tras acuerdo con el Gobierno","
 Representantes del transporte y el Gobierno se reunieron para abordar ...","Ciudades","Aylin Peñaranda","21 de marzo de 2025","https://www.la-razon.com/ciudades/2025/03/21/choferes-suspenden-el-paro-de-48-horas-tras-acuerdo-con-el-gobierno/"
"Sector ganadero se declara en ‘agonía’ por falta de diésel","
 Fegasacruz convocó a una cumbre sectorial ante el colapso en ...","Economía","Daniel Zenteno","15 de marzo de 2025","https://www.la-razon.com/economia/2025/03/15/sector-ganadero-se-declara-en-agonia-por-falta-de-diesel/"
"Se restablece el paso por Llavini y se reanudan los viajes entre La Paz y Cochabamba","
 El presidente de la ABC pidió a los conductores tener ...","Economía","Erika Ibáñez","14 de marzo de 2025","https://www.la-razon.com/economia/2025/03/14/se-restablece-el-paso-por-llavini-y-se-reanudan-los-viajes-entre-la-paz-y-cochabamba/"
"Choferes de El Alto anuncian un paro indefinido debido a la escasez de combustibles","
 El ampliado definió, además, pedir la renuncia del secretario ejecutivo ...","Economía","Erika Ibáñez","14 de marzo de 2025","https://www.la-razon.com/economia/2025/03/14/choferes-de-el-alto-anuncian-un-paro-indefinido-debido-a-la-escasez-de-combustibles/"
"Cooperativistas conminan al Gobierno a resolver en 72 horas la crisis de combustible","
 Fencomin RL reclama por el “despilfarro” del Gobierno y dijo ...","Economía","Erika Ibáñez","14 de marzo de 2025","https://www.la-razon.com/economia/2025/03/14/cooperativistas-conminan-al-gobierno-a-resolver-en-72-horas-la-crisis-de-combustible/"
"Porongo se suma a Santa Cruz de la Sierra y se declara en emergencia por falta de combustible","
 El alcalde Neptaly Mendoza entregó la resolución al presidente del ...","Economía","Erika Ibáñez","14 de marzo de 2025","https://www.la-razon.com/economia/2025/03/14/porongo-se-suma-a-santa-cruz-de-la-sierra-y-se-declara-en-emergencia-por-falta-de-combustible/"
"Familias afectadas por las lluvias ya superan las 300.000 en el país","
 La temporada de precipitaciones causa desastres y muertes en varios ...","Sociedad","Aylin Peñaranda","21 de marzo de 2025","https://www.la-razon.com/sociedad/2025/03/21/familias-afectadas-por-las-lluvias-ya-superan-las-300-000-en-el-pais/"
"Sube a tres los muertos por colapso de puente en Ecuador","
 Luego del siniestro, un tráiler cargado con maíz quedó atrapado ...","Mundo","AFP","21 de marzo de 2025","https://www.la-razon.com/mundo/2025/03/21/sube-a-tres-los-muertos-por-colapso-de-puente-en-ecuador/"
"Mueren 44 civiles en un ataque yihadista en el suroeste de Níger","
 El pueblo de Fonbita, en la comuna rural de Kokorou, ...","Mundo","AFP","21 de marzo de 2025","https://www.la-razon.com/mundo/2025/03/21/ataque-yihadista-en-niger/"
"Choferes suspenden el paro de 48 horas tras acuerdo con el Gobierno","
 Representantes del transporte y el Gobierno se reunieron para abordar ...","Ciudades","Aylin Peñaranda","21 de marzo de 2025","https://www.la-razon.com/ciudades/2025/03/21/choferes-suspenden-el-paro-de-48-horas-tras-acuerdo-con-el-gobierno/"
"Desde 2022, la base empresarial de Bolivia registra un crecimiento de 9%","
 Según el Seprec, el análisis de la inscripción diaria muestra ...","Economía","Erika Ibáñez","14 de marzo de 2025","https://www.la-razon.com/economia/2025/03/14/desde-2022-la-base-empresarial-de-bolivia-registra-un-crecimiento-de-9/"
"Gobierno pide calma y alerta que subida de precio de productos no debe pasar de Bs 1,20","
 El viceministro Lacoa y el gerente de Emapa advirtieron que ...","Economía","Erika Ibáñez","14 de marzo de 2025","https://www.la-razon.com/economia/2025/03/14/gobierno-pide-calma-y-alerta-que-subida-de-precio-de-productos-no-debe-pasar-de-bs-120/"
"Transporte público rechaza horario continuo, clases virtuales y asignación de surtidores","
 El dirigente Víctor Tarqui dijo que el transporte privado tiene ...","Economía","Erika Ibáñez","14 de marzo de 2025","https://www.la-razon.com/economia/2025/03/14/transporte-publico-rechaza-horario-continuo-clases-virtuales-y-asignacion-de-surtidores/"
"Comisión de Diputados aprobó $us 800 millones en créditos, pero no los trata el pleno","
 En lo que va de gestión legislativa, la Comisión de ...","Economía","Daniel Zenteno","14 de marzo de 2025","https://www.la-razon.com/economia/2025/03/14/comision-de-diputados-aprobo-us-800-millones-en-creditos-pero-no-los-trata-el-pleno/"
"La Defensoría del Pueblo exige soluciones, no ‘medidas paliativas’ para enfrentar crisis","
 En un comunicado, la entidad dijo que la falta de ...","Economía","Erika Ibáñez","14 de marzo de 2025","https://www.la-razon.com/economia/2025/03/14/la-defensoria-del-pueblo-exige-soluciones-no-medidas-paliativas-para-enfrentar-crisis/"
"Familias afectadas por las lluvias ya superan las 300.000 en el país","
 La temporada de precipitaciones causa desastres y muertes en varios ...","Sociedad","Aylin Peñaranda","21 de marzo de 2025","https://www.la-razon.com/sociedad/2025/03/21/familias-afectadas-por-las-lluvias-ya-superan-las-300-000-en-el-pais/"
"Sube a tres los muertos por colapso de puente en Ecuador","
 Luego del siniestro, un tráiler cargado con maíz quedó atrapado ...","Mundo","AFP","21 de marzo de 2025","https://www.la-razon.com/mundo/2025/03/21/sube-a-tres-los-muertos-por-colapso-de-puente-en-ecuador/"
"Mueren 44 civiles en un ataque yihadista en el suroeste de Níger","
 El pueblo de Fonbita, en la comuna rural de Kokorou, ...","Mundo","AFP","21 de marzo de 2025","https://www.la-razon.com/mundo/2025/03/21/ataque-yihadista-en-niger/"
"Choferes suspenden el paro de 48 horas tras acuerdo con el Gobierno","
 Representantes del transporte y el Gobierno se reunieron para abordar ...","Ciudades","Aylin Peñaranda","21 de marzo de 2025","https://www.la-razon.com/ciudades/2025/03/21/choferes-suspenden-el-paro-de-48-horas-tras-acuerdo-con-el-gobierno/"
"Se decomisan alimentos y carburantes por casi Bs 4 millones de contrabando a la inversa","
 El viceministro de Lucha contra el Contrabando, dijo que decomisaron ...","Economía","Erika Ibáñez","14 de marzo de 2025","https://www.la-razon.com/economia/2025/03/14/se-decomisan-alimentos-y-carburantes-por-casi-bs-4-millones-de-contrabando-a-la-inversa/"
"Yacimientos niega crisis en la producción de gas natural y licuado","
 El presidente de la estatal afirmó que existe “un tema ...","Economía","Daniel Zenteno","14 de marzo de 2025","https://www.la-razon.com/economia/2025/03/14/yacimientos-niega-crisis-en-la-produccion-de-gas-natural-y-licuado/"
"Dorgathen: Las filas por combustible no van a desaparecer, pero serán menores","
 De acuerdo con el presidente de la estatal, las filas ...","Economía","Daniel Zenteno","14 de marzo de 2025","https://www.la-razon.com/economia/2025/03/14/dorgathen-las-filas-por-combustible-no-van-a-desaparecer-pero-seran-menores/"
"Tres buques con 90 millones de litros de combustibles llegan a Sica Sica","
 El presidente de la estatal YPFB detalló que esta cantidad ...","Economía","Daniel Zenteno","14 de marzo de 2025","https://www.la-razon.com/economia/2025/03/14/tres-buques-con-90-millones-de-litros-de-combustibles-llegan-a-sica-sica/"
"La Cainco califica de ‘inviable’ la demanda de incremento salarial de la COB","
 El presidente de la entidad, Jean Pierre Antelo, recordó que ...","Economía","Erika Ibáñez","14 de marzo de 2025","https://www.la-razon.com/economia/2025/03/14/la-cainco-califica-de-inviable-la-demanda-de-incremento-salarial-de-la-cob/"
"Familias afectadas por las lluvias ya superan las 300.000 en el país","
 La temporada de precipitaciones causa desastres y muertes en varios ...","Sociedad","Aylin Peñaranda","21 de marzo de 2025","https://www.la-razon.com/sociedad/2025/03/21/familias-afectadas-por-las-lluvias-ya-superan-las-300-000-en-el-pais/"
"Sube a tres los muertos por colapso de puente en Ecuador","
 Luego del siniestro, un tráiler cargado con maíz quedó atrapado ...","Mundo","AFP","21 de marzo de 2025","https://www.la-razon.com/mundo/2025/03/21/sube-a-tres-los-muertos-por-colapso-de-puente-en-ecuador/"
